<?xml version="1.0" encoding="UTF-8"?>
<xs:schema xmlns="http://www.uniovi.es" elementFormDefault="qualified" targetNamespace="http://www.uniovi.es" xmlns:xs="http://www.w3.org/2001/XMLSchema">
	<xs:element name="circuito">
		<xs:complexType>
			<xs:sequence>
				<xs:element ref="nombre" />
				<xs:element ref="longitud" />
				<xs:element ref="anchura" />
				<xs:element ref="fecha" />
				<xs:element ref="hora" />
				<xs:element ref="vueltas" />
				<xs:element ref="localidad" />
				<xs:element ref="pais" />
				<xs:element ref="patrocinador" />
				<xs:element ref="referencias" />
				<xs:element ref="galeria" />
				<xs:element ref="punto_origen" />
				<xs:element ref="tramos" />
				<xs:element ref="resultado_carrera" />
				<xs:element ref="clasificacion_mundial" />
			</xs:sequence>
		</xs:complexType>
	</xs:element>
	<xs:element name="nombre" type="xs:string" />
	<xs:element name="longitud">
		<xs:complexType>
			<xs:simpleContent>
				<xs:extension base="xs:integer">
					<xs:attribute name="unidad" type="xs:string" use="required" />
				</xs:extension>
			</xs:simpleContent>
		</xs:complexType>
	</xs:element>
	<xs:element name="anchura">
		<xs:complexType>
			<xs:simpleContent>
				<xs:extension base="xs:integer">
					<xs:attribute name="unidad" type="xs:string" use="required" />
				</xs:extension>
			</xs:simpleContent>
		</xs:complexType>
	</xs:element>
	<xs:element name="fecha" type="xs:date" />
	<xs:element name="hora" type="xs:time" />
	<xs:element name="vueltas" type="xs:integer" />
	<xs:element name="localidad" type="xs:string" />
	<xs:element name="pais" type="xs:string" />
	<xs:element name="patrocinador" type="xs:string" />
	<xs:element name="referencias">
		<xs:complexType>
			<xs:sequence>
				<xs:element minOccurs="3" maxOccurs="unbounded" ref="referencia" />
			</xs:sequence>
		</xs:complexType>
	</xs:element>
	<xs:element name="referencia" type="xs:string" />
	<xs:element name="galeria">
		<xs:complexType>
			<xs:sequence>
				<xs:element minOccurs="1" maxOccurs="5" ref="fotografia" />
				<xs:element minOccurs="1" maxOccurs="3" ref="video" />
			</xs:sequence>
		</xs:complexType>
	</xs:element>
	<xs:element name="fotografia" type="xs:string" />
	<xs:element name="video" type="xs:string" />

	
	<xs:element name="punto_origen">
		<xs:complexType>
			<xs:sequence>
				<xs:element ref="longitud_punto" />
				<xs:element ref="latitud_punto" />
				<xs:element ref="altitud_punto" />
			</xs:sequence>
		</xs:complexType>
	</xs:element>

	<xs:element name="longitud_punto">
		<xs:simpleType>
			<xs:restriction base="xs:float">
				<xs:minInclusive value="-180"/>
				<xs:maxInclusive value="180"/>
			</xs:restriction>
		</xs:simpleType>
	</xs:element>

		<xs:element name="latitud_punto">
		<xs:simpleType>
			<xs:restriction base="xs:float">
				<xs:minInclusive value="-90"/>
				<xs:maxInclusive value="90"/>
			</xs:restriction>
		</xs:simpleType>
	</xs:element>



	<xs:element name="altitud_punto">
		<xs:complexType>
			<xs:simpleContent>
				<xs:extension base="AltitudType">
					<xs:attribute name="unidad" type="xs:string" use="required" />
				</xs:extension>
			</xs:simpleContent>
		</xs:complexType>
	</xs:element>

	<xs:simpleType name="AltitudType">
		<xs:restriction base="xs:float">
			<xs:minInclusive value="0"/>
			<xs:maxInclusive value="5000"/>
		</xs:restriction>
	</xs:simpleType>



	<xs:element name="tramos">
		<xs:complexType>
			<xs:sequence>
				<xs:element minOccurs="1" maxOccurs="unbounded" ref="tramo" />
			</xs:sequence>
		</xs:complexType>
	</xs:element>
	<xs:element name="tramo">
		<xs:complexType>
			<xs:sequence>
				<xs:element ref="distancia" />
				<xs:element ref="punto_origen" />
				<xs:element ref="sector" />
			</xs:sequence>
		</xs:complexType>
	</xs:element>
	<xs:element name="distancia">
		<xs:complexType>
			<xs:simpleContent>
				<xs:extension base="xs:integer">
					<xs:attribute name="unidad" type="xs:string" use="required" />
				</xs:extension>
			</xs:simpleContent>
		</xs:complexType>
	</xs:element>
	<xs:element name="sector" type="xs:integer" />
	<xs:element name="resultado_carrera">
		<xs:complexType>
			<xs:sequence>
				<xs:element ref="nombre_piloto" />
				<xs:element ref="tiempo" />
			</xs:sequence>
		</xs:complexType>
	</xs:element>
	<xs:element name="tiempo" type="xs:duration" />
	<xs:element name="clasificacion_mundial">
		<xs:complexType>
			<xs:sequence>
				<xs:element minOccurs="3" maxOccurs="3" ref="piloto" />
			</xs:sequence>
		</xs:complexType>
	</xs:element>
	<xs:element name="piloto">
		<xs:complexType>
			<xs:sequence>
				<xs:element ref="nombre_piloto" />
				<xs:element ref="puntos" />
				<xs:element ref="posicion" />
			</xs:sequence>
		</xs:complexType>
	</xs:element>
	<xs:element name="nombre_piloto" type="xs:string" />
	<xs:element name="puntos" type="xs:integer" />
	<xs:element name="posicion" type="xs:integer" />
</xs:schema>